{
  "$schema": "./manifest-fragment.schema.json",
  "schemaVersion": 1,
  "issue": 44,
  "sourceContract": {
    "path": "issue-38/content/world_r1_r6.json",
    "sha256": "f533f3e6b1a7468631e55e49c8d6c61cf14b4a42422cff02c2f6ae6ccc1acada"
  },
  "regions": [
    {
      "id": "r03",
      "nameKo": "막차 없는 지하철",
      "paletteFile": "art-source/issue-44-r3-r4/palettes/r03_subway16.gpl",
      "paletteAnchors": ["#111D33", "#E4572E", "#F3A712", "#7B8794"],
      "eliteStageAllocation": [
        {"localStage": 5, "entityId": "turnstile_hound"},
        {"localStage": 15, "entityId": "switchgear_mantis"},
        {"localStage": 25, "entityId": "turnstile_hound"},
        {"localStage": 35, "entityId": "switchgear_mantis"},
        {"localStage": 45, "entityId": "turnstile_hound"},
        {"localStage": 55, "entityId": "switchgear_mantis"}
      ]
    },
    {
      "id": "r04",
      "nameKo": "침몰선 묘지",
      "paletteFile": "art-source/issue-44-r3-r4/palettes/r04_shipgrave16.gpl",
      "paletteAnchors": ["#0D2B45", "#176B87", "#35A7A0", "#F07167"],
      "eliteStageAllocation": [
        {"localStage": 5, "entityId": "crane_octopus"},
        {"localStage": 15, "entityId": "diving_bell_manta"},
        {"localStage": 25, "entityId": "crane_octopus"},
        {"localStage": 35, "entityId": "diving_bell_manta"},
        {"localStage": 45, "entityId": "crane_octopus"},
        {"localStage": 55, "entityId": "diving_bell_manta"}
      ]
    }
  ],
  "assets": [
    {
      "id": "enemy_r03_ticket_mouse",
      "regionId": "r03",
      "entityId": "ticket_mouse",
      "nameKo": "표딱지쥐",
      "nameEn": "Ticket-Stub Mouse",
      "class": "normal",
      "kind": "enemy_small",
      "behaviorId": "ticket_swarm",
      "behaviorKo": "세 마리 군집",
      "weakness": "impact",
      "secondaryWeaknesses": [],
      "breakSequenceKo": "표 귀 펀칭→몸통 분리",
      "canvas": [32, 32],
      "pivot": [16, 28],
      "paletteFile": "art-source/issue-44-r3-r4/palettes/r03_subway16.gpl",
      "scalePolicy": "integer_nearest",
      "status": "planned",
      "sourceFile": "art-source/issue-44-r3-r4/originals/enemy_r03_ticket_mouse.png",
      "transparentFile": "art-source/issue-44-r3-r4/transparent/enemy_r03_ticket_mouse.png",
      "file": "art-export/issue-44-r3-r4/production/enemy_r03_ticket_mouse.png"
    },
    {
      "id": "enemy_r03_fluorescent_snake",
      "regionId": "r03",
      "entityId": "fluorescent_snake",
      "nameKo": "형광등뱀",
      "nameEn": "Fluorescent-Tube Snake",
      "class": "normal",
      "kind": "enemy_wide",
      "behaviorId": "two_step_flicker",
      "behaviorKo": "두 관이 교대 점멸",
      "weakness": "impact",
      "secondaryWeaknesses": [],
      "breakSequenceKo": "형광관 1개→안정기 머리",
      "canvas": [64, 48],
      "pivot": [32, 42],
      "paletteFile": "art-source/issue-44-r3-r4/palettes/r03_subway16.gpl",
      "scalePolicy": "integer_nearest",
      "status": "planned",
      "sourceFile": "art-source/issue-44-r3-r4/originals/enemy_r03_fluorescent_snake.png",
      "transparentFile": "art-source/issue-44-r3-r4/transparent/enemy_r03_fluorescent_snake.png",
      "file": "art-export/issue-44-r3-r4/production/enemy_r03_fluorescent_snake.png"
    },
    {
      "id": "enemy_r03_seat_armor",
      "regionId": "r03",
      "entityId": "seat_armor",
      "nameKo": "좌석갑옷",
      "nameEn": "Subway-Seat Armor",
      "class": "normal",
      "kind": "enemy_medium",
      "behaviorId": "seat_fold",
      "behaviorKo": "좌석을 접어 장갑 전환",
      "weakness": "cut",
      "secondaryWeaknesses": [],
      "breakSequenceKo": "등받이→방석→프레임",
      "canvas": [48, 48],
      "pivot": [24, 42],
      "paletteFile": "art-source/issue-44-r3-r4/palettes/r03_subway16.gpl",
      "scalePolicy": "integer_nearest",
      "status": "planned",
      "sourceFile": "art-source/issue-44-r3-r4/originals/enemy_r03_seat_armor.png",
      "transparentFile": "art-source/issue-44-r3-r4/transparent/enemy_r03_seat_armor.png",
      "file": "art-export/issue-44-r3-r4/production/enemy_r03_seat_armor.png"
    },
    {
      "id": "enemy_r03_vent_jellyfish",
      "regionId": "r03",
      "entityId": "vent_jellyfish",
      "nameKo": "환풍기해파리",
      "nameEn": "Vent-Fan Jellyfish",
      "class": "normal",
      "kind": "enemy_medium",
      "behaviorId": "vent_float",
      "behaviorKo": "환풍으로 부유",
      "weakness": "electric",
      "secondaryWeaknesses": [],
      "breakSequenceKo": "덕트 촉수→팬 코어",
      "canvas": [48, 48],
      "pivot": [24, 42],
      "paletteFile": "art-source/issue-44-r3-r4/palettes/r03_subway16.gpl",
      "scalePolicy": "integer_nearest",
      "status": "planned",
      "sourceFile": "art-source/issue-44-r3-r4/originals/enemy_r03_vent_jellyfish.png",
      "transparentFile": "art-source/issue-44-r3-r4/transparent/enemy_r03_vent_jellyfish.png",
      "file": "art-export/issue-44-r3-r4/production/enemy_r03_vent_jellyfish.png"
    },
    {
      "id": "elite_r03_turnstile_hound",
      "regionId": "r03",
      "entityId": "turnstile_hound",
      "nameKo": "개찰구견",
      "nameEn": "Turnstile Hound",
      "class": "elite",
      "kind": "enemy_large",
      "behaviorId": "three_signal_heads",
      "behaviorKo": "세 머리 신호 속성 순환",
      "weakness": "electric",
      "secondaryWeaknesses": [],
      "breakSequenceKo": "녹색→황색→적색 머리",
      "canvas": [64, 64],
      "pivot": [32, 58],
      "paletteFile": "art-source/issue-44-r3-r4/palettes/r03_subway16.gpl",
      "scalePolicy": "integer_nearest",
      "status": "planned",
      "sourceFile": "art-source/issue-44-r3-r4/originals/elite_r03_turnstile_hound.png",
      "transparentFile": "art-source/issue-44-r3-r4/transparent/elite_r03_turnstile_hound.png",
      "file": "art-export/issue-44-r3-r4/production/elite_r03_turnstile_hound.png"
    },
    {
      "id": "elite_r03_switchgear_mantis",
      "regionId": "r03",
      "entityId": "switchgear_mantis",
      "nameKo": "분기기사마귀",
      "nameEn": "Switchgear Mantis",
      "class": "elite",
      "kind": "enemy_large",
      "behaviorId": "switch_track_charge",
      "behaviorKo": "점등한 분기 선로를 따라 낫팔 돌진",
      "weakness": "heat",
      "secondaryWeaknesses": [],
      "breakSequenceKo": "분기등→전철기 낫팔→릴레이 코어",
      "extension": "1.0 콘텐츠 확장: R3 두 번째 엘리트",
      "canvas": [64, 64],
      "pivot": [32, 58],
      "paletteFile": "art-source/issue-44-r3-r4/palettes/r03_subway16.gpl",
      "scalePolicy": "integer_nearest",
      "status": "planned",
      "sourceFile": "art-source/issue-44-r3-r4/originals/elite_r03_switchgear_mantis.png",
      "transparentFile": "art-source/issue-44-r3-r4/transparent/elite_r03_switchgear_mantis.png",
      "file": "art-export/issue-44-r3-r4/production/elite_r03_switchgear_mantis.png"
    },
    {
      "id": "boss_r03_last_train_engineer",
      "regionId": "r03",
      "entityId": "last_train_engineer",
      "nameKo": "막차 기관수",
      "nameEn": "Last-Train Engineer",
      "class": "boss",
      "kind": "boss",
      "behaviorId": "rail_signal_charge",
      "behaviorKo": "선로 돌진과 신호 변경",
      "weakness": "cooling",
      "secondaryWeaknesses": ["impact"],
      "breakSequenceKo": "녹→황→적 타이밍 뒤 차륜 인양",
      "canvas": [128, 96],
      "pivot": [64, 90],
      "paletteFile": "art-source/issue-44-r3-r4/palettes/r03_subway16.gpl",
      "scalePolicy": "integer_nearest",
      "status": "planned",
      "sourceFile": "art-source/issue-44-r3-r4/originals/boss_r03_last_train_engineer.png",
      "transparentFile": "art-source/issue-44-r3-r4/transparent/boss_r03_last_train_engineer.png",
      "file": "art-export/issue-44-r3-r4/production/boss_r03_last_train_engineer.png"
    },
    {
      "id": "boss_r03_turnstile_cerberus",
      "regionId": "r03",
      "entityId": "turnstile_cerberus",
      "nameKo": "개찰구 케르베로스",
      "nameEn": "Turnstile Cerberus",
      "class": "boss",
      "kind": "boss",
      "behaviorId": "three_gate_bite",
      "behaviorKo": "세 게이트 물기와 표 검사",
      "weakness": "electric",
      "secondaryWeaknesses": [],
      "breakSequenceKo": "올바른 표를 세 게이트에 순서 배치",
      "canvas": [144, 112],
      "pivot": [72, 106],
      "paletteFile": "art-source/issue-44-r3-r4/palettes/r03_subway16.gpl",
      "scalePolicy": "integer_nearest",
      "status": "planned",
      "sourceFile": "art-source/issue-44-r3-r4/originals/boss_r03_turnstile_cerberus.png",
      "transparentFile": "art-source/issue-44-r3-r4/transparent/boss_r03_turnstile_cerberus.png",
      "file": "art-export/issue-44-r3-r4/production/boss_r03_turnstile_cerberus.png"
    },
    {
      "id": "background_r03_last_train_subway",
      "regionId": "r03",
      "entityId": "background_r03_last_train_subway",
      "nameKo": "막차 없는 지하철 전투 배경",
      "nameEn": "Last-Train Subway Battle Backdrop",
      "class": "background",
      "kind": "background",
      "behaviorId": "static_battle_lane",
      "behaviorKo": "중앙 전투 레인과 신호등 텔레그래프 공간",
      "weakness": "none",
      "secondaryWeaknesses": [],
      "breakSequenceKo": "해당 없음",
      "canvas": [360, 572],
      "pivot": [0, 572],
      "paletteFile": "art-source/issue-44-r3-r4/palettes/r03_subway16.gpl",
      "scalePolicy": "integer_nearest",
      "status": "planned",
      "sourceFile": "art-source/issue-44-r3-r4/originals/background_r03_last_train_subway.png",
      "file": "art-export/issue-44-r3-r4/production/background_r03_last_train_subway.png"
    },
    {
      "id": "enemy_r04_anchor_crab",
      "regionId": "r04",
      "entityId": "anchor_crab",
      "nameKo": "앵커게",
      "nameEn": "Anchor Crab",
      "class": "normal",
      "kind": "enemy_medium",
      "behaviorId": "chain_anchor",
      "behaviorKo": "체인 세 칸으로 지면 고정",
      "weakness": "impact",
      "secondaryWeaknesses": [],
      "breakSequenceKo": "닻 팔→체인→부표 코어",
      "canvas": [48, 48],
      "pivot": [24, 42],
      "paletteFile": "art-source/issue-44-r3-r4/palettes/r04_shipgrave16.gpl",
      "scalePolicy": "integer_nearest",
      "status": "planned",